1,White/European,,1,1,23,Four-year college degree,Theatre Education ,3,3,4,5,4,5,3,2,4,3,2,4,2,5,2,4,4,2,4,2,5,68,3,4,2,5,5,1,3,3,4,3,4,4,4,3,3,2,4,4,4,1,1,3,3,4,3,1,1,3,1,2,2,3,2,1,1,1,3,3,2,1,4,4,5,0,2,4,3,5,3,3,5,5,4,5,5,5,4,2,3,4,4,4,4,4,4,3,3,,3,1,Access to better education 
1,White/European,,1,1,42,Master's degree,Education,4,4,4,5,4,5,3,2,1,4,1,3,4,5,3,3,4,3,4,3,4,60,4,2,3,5,4,3,3,3,3,3,3,2,3,1,1,2,5,4,3,1,5,4,4,4,3,3,3,3,3,3,5,5,5,3,0,0,5,3,1,1,5,5,1,1,5,5,4,5,3,3,5,4,4,3,1,3,4,3,3,3,3,3,3,4,3,3,3,,3,2,Society will continue to push to end any racial lines in terms of standardized testing or inequalities.
1,White/European,,1,1,57,Four-year college degree,Elementary Education,2,2,4,3,5,4,2,2,4,2,1,4,5,4,2,4,4,3,5,3,5,70,2,1,3,5,1,1,1,3,1,2,3,4,4,3,3,3,2,5,1,1,5,4,2,5,1,5,1,2,1,4,3,6,3,2,2,0,10,3,11,0,6,2,1,0,5,4,4,5,3,3,4,4,5,1,1,3,3,3,3,4,3,3,4,4,4,5,3,I don't know,4,1,Hopefully the quality of education will equalize.
1,White/European,,1,1,47,Master's degree,Curriculum and instruction,1,2,4,3,4,5,2,2,3,3,2,3,4,5,2,4,4,4,4,4,4,70,1,2,3,5,4,1,2,3,2,2,3,3,4,1,3,3,3,3,3,1,5,4,4,4,1,1,1,1,1,1,2,3,3,2,1,3,5,3,4,1,5,5,1,1,3,3,3,4,3,3,4,4,4,3,3,5,4,4,3,3,4,5,4,3,4,4,3,,4,0,I don't know that anything is being done to remedy any issues that create the differences. I don't know if any research shows what actually does make a difference. I'd love to know!
1,White/European,,1,1,34,Master's degree,Secondary Education,4,3,4,5,4,5,3,2,2,3,2,4,2,5,4,4,4,5,4,4,5,56,3,3,3,5,3,3,3,4,3,3,4,4,4,2,3,3,3,5,4,1,3,4,4,5,4,8,18,18,18,8,15,20,13,16,2,4,15,3,8,1,11,19,5,1,18,4,3,5,4,3,5,4,5,4,2,5,4,4,3,3,4,4,5,4,5,5,3,NA,4,0,Over the past 100 years the ways of education has not changed. In addition one must also reflect on the true purpose and intent of IQ tests at the onset of it. A bigger question is will IQ tests become more or less valid and reliable in 50 years?
1,White/European,,1,1,45,Master's degree,Business,4,2,5,4,4,5,2,2,4,2,1,5,5,5,2,4,5,2,5,4,5,50,4,4,4,5,5,2,2,4,5,4,3,2,4,1,3,2,2,4,4,1,5,4,4,5,5,5,5,5,5,5,5,5,5,0,0,0,10,3,5,5,10,5,0,5,3,5,4,5,3,3,5,5,5,5,5,5,5,2,3,4,2,5,4,4,5,5,3,,1,0,I think they have been relatively consistent for many years and it doesn't seem that we're trying to change.
1,White/European,,1,1,55,Master's degree,Education,4,2,4,5,4,5,3,2,4,4,1,2,5,5,4,2,5,2,4,2,4,80,4,2,2,5,1,2,2,4,2,4,4,4,4,1,4,3,2,4,4,1,3,4,2,3,9,12,4,4,2,12,16,16,8,5,0,5,20,3,15,0,10,15,4,9,5,4,4,5,4,4,5,4,5,5,5,5,4,2,3,4,3,4,2,4,4,4,3,None,3,0,I don't think they've changed much in the past 50 years. Our society tends to deny that bias exists so I don't see why they would change in the future. 
1,Other (Please Specify),,1,0,52,Master's degree,Education ,4,2,5,5,5,5,4,2,4,3,4,5,5,5,1,5,5,5,5,1,5,75,5,4,3,5,5,1,4,5,4,3,5,3,4,1,4,2,5,5,1,1,1,5,4,5,10,15,15,15,20,20,20,20,20,20,20,15,20,3,10,1,20,20,20,15,20,1,5,5,4,5,4,5,5,5,5,5,5,5,3,5,5,5,5,5,5,5,3,,1,0,No time yo answer
1,Asian American,,1,1,39,Master's degree,Elementary Education,2,4,5,5,5,4,4,2,4,4,2,3,4,5,2,4,4,4,5,4,5,65,3,4,3,5,2,3,3,3,1,4,4,4,4,2,3,3,4,5,1,1,5,5,3,5,2,12,10,14,5,7,13,20,11,7,1,1,20,3,7,1,16,13,14,1,10,5,4,5,4,4,5,4,4,4,4,4,4,3,3,3,4,5,4,5,5,4,3,?,4,1,If stereotypes continue and public education funding in lower class communities continue to have cuts not much will change. 
1,White/European,,1,1,34,Four-year college degree,Education ,2,1,5,4,5,4,5,2,4,2,2,2,4,4,4,2,4,2,4,2,5,80,2,5,5,5,1,4,1,5,2,4,5,4,4,2,3,2,5,5,5,1,2,5,2,4,2,2,7,7,3,3,10,15,15,10,5,6,20,3,10,5,15,15,10,4,10,5,5,4,3,4,5,5,4,4,5,4,5,3,3,2,2,4,4,3,4,4,3,None,4,1,Education reform in America making better public schools for all
1,White/European,,1,1,31,Four-year college degree,Elementary Education,5,2,5,5,3,5,4,2,4,3,1,4,5,5,4,5,4,4,5,4,5,65,4,2,2,5,5,1,5,2,4,2,2,4,2,1,1,1,4,4,4,1,4,2,2,4,15,13,20,20,7,3,13,20,20,4,5,13,20,3,16,12,20,20,20,8,13,5,4,5,4,4,5,5,5,4,2,4,5,3,3,5,5,4,4,4,5,5,3,,2,1,..
1,White/European,,1,1,59,Master's degree,Education,4,4,4,5,5,4,2,2,2,4,2,4,5,5,2,3,4,4,5,2,4,50,4,4,3,5,4,2,2,3,4,2,4,5,5,1,1,1,4,5,1,1,5,4,2,2,5,5,16,16,12,10,3,10,10,5,0,10,20,3,15,3,10,20,5,1,5,4,5,4,2,2,5,5,5,2,2,4,5,2,3,4,4,3,3,3,5,5,5,Parent education level,4,0,Change is resisted
1,White/European,,1,1,39,Master's degree,Gifted Education,1,1,5,5,5,4,5,2,1,2,1,4,5,1,2,4,5,4,5,2,5,60,1,2,5,5,1,1,4,5,4,5,5,5,5,1,4,2,5,5,2,1,5,5,2,4,0,0,7,10,2,0,2,5,5,2,0,0,5,3,5,0,2,1,1,0,0,3,4,5,4,4,5,5,4,4,5,1,5,4,3,4,4,1,4,4,5,1,4,Test selected do not match individual student strengths or areas of giftedness - for ex overuse of one set group ability test multiple choice vs careful selection of an individual Iq test like DAS for low income or ELL and WISC for possible 2e SB for students with advanced verbal ability STB for spatial ability etc. ,4,-1,Trump is destroying America. Negative impacts of his administration on just about every factor listed above. Widening income gaps and lack of access and funding for high needs schools. 
1,White/European,,1,1,32,Master's degree,Education ,4,4,5,5,4,5,2,2,3,4,4,4,5,4,1,3,5,3,5,3,5,50,1,3,3,5,2,5,3,4,3,3,4,5,4,2,3,4,1,1,4,1,5,4,2,5,10,15,0,0,0,1,11,10,10,5,0,0,15,3,10,0,10,0,0,0,0,5,5,5,4,4,5,4,4,3,3,4,4,4,3,4,4,5,3,4,3,4,3,,2,2,As there are more interracial marriages 
1,White/European,,1,1,34,Four-year college degree,Education,4,3,4,5,4,4,2,2,3,5,1,5,5,5,4,5,4,4,5,4,3,47,4,4,3,5,4,1,2,3,3,4,2,4,3,3,3,3,5,4,1,1,5,3,3,3,4,1,6,13,1,1,11,11,11,6,4,2,15,3,13,2,14,7,2,8,14,5,2,5,4,3,5,5,4,1,3,2,5,2,3,4,4,3,3,4,5,4,3,,3,1,I think that knowing there is a problem will begin to lead to a solution. I don't think it will be a permanent fix but it will slightly close the gap.
1,White/European,,1,1,46,Four-year college degree,Art Education,4,2,4,5,4,4,2,2,2,2,1,3,2,5,2,3,3,4,4,5,5,70,2,2,4,5,2,1,3,2,4,3,3,4,4,2,1,4,2,5,1,1,5,4,2,2,2,10,5,20,1,10,8,20,8,8,3,5,20,3,14,2,10,20,3,7,13,5,5,5,4,2,5,3,5,2,2,2,5,3,3,4,3,2,3,4,3,2,5,Parents expectations and consequences for the family,4,-1,Educators want and expect the best from their students. The problems that will continue to widen the gap are schools not enforcing consequences because of fear from the parents funding being taken and the constant high stakes testing. 
1,White/European,,1,0,35,Master's degree,Physics,1,1,5,3,5,2,3,2,4,1,4,1,5,2,5,1,5,2,5,1,5,60,1,4,5,5,1,3,2,5,5,5,5,5,5,1,1,1,3,5,3,1,5,5,5,4,0,0,4,5,7,1,2,4,0,0,0,0,10,3,5,0,3,4,0,5,4,4,3,5,5,5,5,5,4,4,4,4,4,1,3,3,2,3,4,4,4,4,3,?,1,1,Hopefully the reasons I cited to be most relevant for the score gaps will have been somewhat reduced by then.
1,White/European,,1,1,49,Master's degree,MA gifted education,5,4,4,5,3,5,1,2,1,2,1,5,4,4,1,4,4,4,5,4,5,80,4,3,3,5,3,2,4,4,4,3,4,4,4,1,3,2,4,4,3,1,2,4,3,4,6,5,8,14,5,3,6,12,10,8,2,4,10,3,10,2,8,8,5,5,8,5,5,5,4,4,5,5,5,4,5,4,4,3,3,4,4,4,4,4,5,4,3,,5,1,Because we need systemic change in how we define and assess intelligence
1,White/European,,1,1,38,Master's degree,Teaching and Learning,2,2,5,4,4,3,2,2,2,4,1,4,5,2,2,4,3,4,4,4,5,37,2,1,2,5,4,2,2,2,4,2,4,2,5,1,1,2,4,5,4,1,4,2,2,2,0,0,10,10,0,0,2,5,0,0,0,0,3,3,5,0,6,5,5,0,3,5,5,5,2,2,5,5,4,5,5,4,2,1,3,2,4,4,4,4,5,4,3,None,3,1,We would need a substantial change to our education and political systems to see major changes to intelligence. 
1,White/European,,1,1,42,Four-year college degree,Elementary Education ,2,2,4,5,4,5,2,2,2,5,1,4,4,5,1,4,4,5,5,4,4,62,3,1,3,5,4,1,3,2,1,2,2,5,2,2,2,2,4,5,4,1,5,2,1,4,10,10,2,12,5,2,8,8,6,3,3,3,12,3,4,3,10,10,3,3,9,5,4,5,4,4,5,4,4,4,4,5,3,1,3,4,4,4,3,4,4,4,3,,2,3,I think we're trying to become more equitable I just don't know how quickly change will come. 
1,White/European,,1,1,39,Master's degree,Education- specialty in gifted,1,3,5,4,4,4,2,2,3,2,1,3,4,1,4,4,4,3,5,3,5,69,1,4,4,5,1,4,4,5,4,4,4,5,5,1,3,2,2,5,1,1,5,4,4,3,2,0,10,10,5,0,0,0,0,0,0,0,0,3,0,0,0,0,0,0,0,3,3,5,1,1,5,4,3,4,4,4,4,1,3,4,3,4,3,1,1,3,4,References on tests that bias toward mainstream cultures ,1,0,I don't believe substantial changes are being made to address these differences. 
1,White/European,,1,1,59,Master's degree,Education administration,4,3,4,5,4,5,3,2,2,4,2,3,4,3,2,4,4,2,4,3,4,80,4,1,3,5,2,1,2,3,4,2,3,4,4,2,3,2,4,5,3,1,5,4,2,2,4,4,6,10,4,0,6,7,9,5,0,5,9,3,2,0,1,3,2,0,0,4,4,5,4,4,4,5,4,5,5,4,4,2,3,4,4,4,3,4,4,3,3,,4,2,More awareness and efforts to close opportunity gaps.
1,White/European,,1,1,32,Master's degree,Education ,2,4,5,5,5,5,5,2,3,2,1,3,4,4,4,3,4,4,5,2,5,70,1,2,2,5,2,2,4,3,1,1,3,4,5,1,1,1,4,5,5,1,5,3,2,4,0,0,0,2,0,0,0,0,0,0,0,0,2,3,1,0,0,0,0,0,0,5,4,5,3,3,5,5,4,2,1,5,4,1,3,3,1,4,5,2,2,3,3,,1,1,The gifted community is working hard to spread the word and schools are responding slowly but surely!
1,White/European,,1,1,43,Four-year college degree,Social Studies,4,2,5,4,5,5,2,2,4,4,1,2,4,5,3,2,4,4,5,3,4,73,2,1,1,5,1,2,3,3,1,1,4,4,4,2,3,3,2,5,4,1,5,5,2,2,0,2,3,4,4,2,3,3,3,0,0,0,4,3,6,1,1,5,0,0,0,3,3,5,4,4,5,5,4,5,5,5,1,1,3,2,3,4,4,4,4,4,5,Racial bias of the teacher. ,1,1,Poverty systemic racism & teacher biass
1,White/European,,1,1,38,Master's degree,MA special education post masters certificate educational diagnostics,1,1,5,5,3,4,1,2,2,4,2,4,4,5,1,4,3,5,4,3,2,60,2,1,1,5,2,2,4,3,1,3,3,5,5,1,3,3,1,5,1,1,5,3,3,4,1,4,2,4,4,4,4,5,5,3,1,1,5,3,5,0,0,0,0,0,3,3,3,1,3,3,3,4,4,4,4,5,4,4,3,3,4,4,5,4,4,4,3,None,4,1,As we learn more about intelligence culture SES impact I believe we will develop more appropriate intelligence tests that are sensitive to these issues. However I do not believe the gap will close substantially.
1,White/European,,1,1,43,Master's degree,Education,4,2,4,5,4,5,1,2,2,2,2,4,5,5,4,5,3,5,4,3,5,68,2,3,3,5,4,2,1,4,1,1,4,5,4,1,1,1,2,3,1,1,3,4,2,2,1,4,1,4,1,2,3,4,4,2,1,1,4,3,2,1,2,2,1,1,1,5,5,5,4,4,5,5,5,2,2,2,5,2,3,3,4,2,4,4,4,4,3,none,4,2,As we become a more blended society and more politically correct I believe the gap will narrow between ethnic groups.
1,White/European,,1,1,60,Master's degree,English Literature,3,5,4,5,4,2,3,2,3,3,1,4,5,5,2,4,5,3,5,3,5,75,3,4,3,5,1,2,1,4,2,3,3,5,5,3,3,2,2,5,2,1,5,5,3,4,0,10,0,10,0,4,4,4,4,0,0,0,10,3,5,0,14,5,1,0,2,1,1,5,4,4,5,4,5,4,3,3,3,3,3,4,4,4,5,3,4,5,5,Genetics expectations,3,0,Because of Genetics
1,White/European,,1,1,55,Master's degree,History Master of Arts,2,2,5,5,5,5,2,2,1,4,2,4,5,5,4,4,4,2,5,4,5,75,2,4,2,5,1,1,2,4,4,4,4,5,5,1,2,2,5,5,4,1,5,5,4,4,3,5,5,10,3,3,3,11,11,4,0,5,10,3,10,2,10,10,2,2,6,5,5,5,4,4,5,5,5,3,4,4,5,4,3,4,4,4,5,4,4,5,5,Differences in cultural expectations for education ,2,1,Until there is a shift in the cultural expectations of early childhood (from infancy) of a child's caregivers (parents living environment) that not only realizes their long term effect in a child's intelligence but insures that they meet the needs of that child the rest of the factors that determine intelligence will always be playing catch-up to overcome those deficits.
1,White/European,,1,1,43,Master's degree,Psychology,2,4,4,5,4,5,2,2,2,4,2,4,5,5,4,3,4,4,4,3,5,65,2,4,3,5,2,4,2,4,2,4,4,4,4,2,2,4,4,5,4,1,2,5,2,2,1,0,0,2,0,0,0,0,0,0,0,0,4,3,0,0,0,0,0,0,0,5,4,5,4,4,4,4,5,3,3,4,4,2,3,3,3,4,3,4,4,4,3,,1,2,Hopefully our societies are changing to be more inclusive and racial differences should not have such an impact in terms of opportunity or perception.
1,White/European,,1,1,57,Master's degree,Education,2,2,5,4,5,4,4,2,3,3,2,4,5,5,4,4,5,4,5,3,5,80,2,5,4,5,1,1,1,4,4,3,4,4,5,1,3,3,3,4,1,1,4,5,3,4,2,3,2,2,0,2,3,3,3,2,0,0,3,3,2,0,1,1,0,0,2,3,3,5,4,2,5,5,5,4,5,4,5,3,3,4,5,4,5,4,4,4,3,??,4,2,Hopefully with another 50 years there will be less bias towards ethnic minorities...and we can do better to improve education/nutrition and other factors for ALL children... AND we can learn to do better at testing IQ's to consider differences...such as language/culture....
1,White/European,,1,1,55,Four-year college degree,Elementary Education ,4,5,3,5,4,5,2,2,1,3,1,5,4,5,1,5,5,4,5,4,4,78,3,5,3,5,4,3,1,4,4,3,4,5,4,2,3,2,4,4,3,1,5,5,2,3,3,5,1,7,1,2,5,9,6,5,1,3,10,3,5,1,5,6,2,5,2,4,4,4,4,4,4,2,4,3,4,3,4,4,3,3,4,4,3,3,3,4,3,,3,1,More of the population is on the same socio-economic scale thus the gaps will not be as wide. 
1,White/European,,1,1,46,Master's degree,Masters of education with an Administrative license,4,4,4,5,4,5,3,2,3,4,2,4,4,5,2,3,3,4,4,3,4,65,2,4,2,5,4,3,3,3,2,2,3,4,4,2,2,2,3,4,4,1,4,3,3,1,0,5,0,3,0,2,2,2,0,0,0,0,5,3,2,0,1,1,1,0,1,3,4,5,2,2,5,4,4,4,5,4,4,3,3,4,4,5,5,4,5,4,3,None,5,1,Too many people that aren't educators trying to change things.  Still too much racism and poverty for these groups.  
1,White/European,,1,1,47,Four-year college degree,Elementary Education,4,4,4,5,2,5,1,2,2,4,3,5,5,5,4,5,5,4,5,4,5,75,4,1,2,5,2,3,4,3,4,3,4,4,4,2,3,2,4,4,4,1,4,4,4,4,8,4,8,13,5,4,6,6,6,5,4,1,11,3,8,4,12,12,10,6,5,5,4,5,4,4,5,5,5,4,4,4,5,2,3,4,5,5,4,4,5,5,3,None,1,1,More awareness of social differences and their effect on education and testing. 
1,White/European,,1,1,51,Master's degree,Education,5,3,4,5,4,5,1,2,1,3,2,3,5,5,1,3,3,4,5,4,5,67,1,3,1,5,4,2,1,2,1,1,3,4,3,2,2,2,2,5,1,1,4,3,2,4,1,1,0,4,0,0,4,4,5,3,0,0,8,3,4,1,0,1,1,0,1,5,5,5,3,3,5,4,4,3,3,4,4,3,3,4,3,3,4,4,4,4,3,,2,0,Tests test material that certain groups are not taught or don't get as much training in
0,African American,,1,0,28,High school diploma or GED,,4,4,3,4,4,3,3,2,4,3,4,2,3,4,3,4,3,3,3,4,3,43,4,4,4,5,3,4,4,2,3,4,4,4,4,4,3,4,4,2,4,1,4,4,4,5,10,5,6,4,14,11,15,11,16,12,10,12,15,3,9,9,12,11,11,14,14,4,4,4,5,4,4,4,4,4,3,4,4,4,3,4,5,4,4,4,5,5,1,None,4,2,They might change
0,White/European,,1,1,60,Four-year college degree,Eduction,5,4,5,4,4,3,5,2,4,5,4,4,5,4,4,5,4,5,5,4,5,62,4,3,2,5,5,2,2,4,5,2,4,5,4,3,5,4,5,5,5,1,4,4,5,4,12,20,5,17,4,4,16,5,14,8,3,3,20,3,6,3,20,5,3,5,5,4,4,4,2,2,4,3,4,2,2,3,3,3,3,4,3,4,3,4,2,2,4,,2,0,Won't change
0,White/European,,1,1,60,Four-year college degree,Education Elementary,3,3,2,3,3,3,3,2,3,3,3,3,3,3,3,3,3,3,3,3,3,41,3,3,3,5,3,3,3,3,3,3,3,3,3,3,3,3,3,3,3,1,3,3,3,3,6,5,6,2,13,2,14,11,15,12,6,16,11,3,10,6,9,3,14,11,13,3,3,3,3,3,3,3,3,3,3,3,3,3,3,3,3,3,3,3,3,3,3,,3,1,Don't know
0,White/European,,1,0,35,Four-year college degree,Bachelors,5,4,4,4,4,3,1,2,2,3,3,5,3,2,1,3,4,4,3,2,4,65,4,2,3,5,2,1,2,4,1,1,4,5,2,3,3,3,4,3,3,1,3,2,3,4,7,9,9,5,11,16,7,13,5,7,15,4,12,3,12,7,13,14,12,17,16,2,2,5,4,3,3,4,4,4,4,2,5,2,3,4,3,2,4,4,2,4,3,,4,0,History has repeated itself
0,White/European,,1,1,35,Four-year college degree,Social sc ience,4,4,4,4,4,4,4,2,3,4,4,4,4,4,4,4,4,5,5,3,3,42,4,4,4,5,4,5,4,4,4,5,5,4,4,4,4,4,4,4,4,1,4,4,4,1,3,8,10,4,7,4,5,15,13,7,5,3,8,3,2,4,5,5,8,6,4,4,4,5,4,4,4,4,4,4,4,4,4,3,3,4,4,4,4,3,4,4,3,,3,-1,Because that's the whey the world iss
0,White/European,,1,1,34,Master's degree,child psicology,4,4,5,4,5,5,4,2,4,3,4,4,4,5,4,4,5,4,4,3,4,68,4,4,4,5,3,4,3,4,4,3,5,4,5,4,4,5,5,4,4,1,4,5,3,4,12,13,20,16,16,17,14,19,20,13,12,20,14,3,18,10,15,8,13,10,12,4,5,3,4,5,5,5,4,4,3,4,5,4,3,4,5,4,4,4,4,4,3,Differences of Religion,5,0,There will not be any significant change because factors such as poverty poor nutrition in the poorest areas of the country have had a significant impact
0,White/European,,1,1,67,Master's degree,education,2,2,4,3,4,4,5,2,3,4,2,4,3,2,3,4,3,3,2,4,4,60,3,3,3,5,2,2,3,4,4,4,4,4,5,4,4,4,3,4,4,1,4,4,4,3,15,13,15,15,13,11,10,8,14,14,9,12,12,3,10,11,11,12,13,15,13,4,4,4,4,4,5,4,4,4,4,3,3,2,3,2,4,4,3,4,3,3,3,,4,0,with better education programs there will no change
0,White/European,,1,0,42,Four-year college degree,Engineering - Mining & Materials,1,5,5,5,5,3,4,2,5,1,5,4,5,5,1,3,5,5,5,2,5,60,3,1,1,5,1,1,1,1,1,1,5,5,4,1,5,3,5,1,1,1,2,4,5,5,9,11,5,8,13,14,12,12,9,3,0,5,6,3,1,0,4,5,4,4,7,5,5,5,3,3,5,1,5,1,1,2,5,4,3,5,3,1,1,1,4,3,3,na,2,3,Everything evolves over time 
0,African American,,1,1,20,Some college or technical school training,,5,3,4,4,5,4,3,2,3,4,4,5,3,4,4,5,4,3,3,4,3,52,5,3,4,5,4,3,4,4,4,5,5,3,3,3,3,3,5,4,3,1,3,3,3,3,7,5,3,8,5,14,17,11,12,8,5,14,5,3,10,7,13,11,12,8,10,3,4,3,3,3,4,3,3,3,4,4,4,3,3,4,5,4,4,4,5,4,1,n/a,3,0,mone
0,White/European,,1,1,60,Master's degree,Pure Math,1,2,4,5,5,4,1,2,4,2,2,2,4,4,3,4,4,3,4,3,5,65,4,3,3,5,3,1,1,4,3,1,3,4,3,2,2,3,3,1,3,1,4,3,3,4,0,2,4,0,0,3,2,4,6,5,0,3,3,3,2,1,4,4,2,0,3,4,4,5,4,4,5,5,4,3,3,4,5,4,3,4,4,5,4,4,5,4,3,,4,-1,I think this way because with technology most people are going to become lazy because technology will be doing most things for people
0,White/European,,1,1,69,Master's degree,Administration,4,3,3,5,4,4,2,2,2,4,3,4,5,4,2,5,3,4,4,4,4,65,2,2,2,5,2,2,4,2,2,3,2,3,4,3,3,3,3,4,2,1,5,4,2,4,17,20,20,20,12,12,11,20,20,20,13,13,20,3,20,20,20,20,10,10,10,4,4,5,3,3,3,4,4,4,4,4,4,3,3,4,3,3,5,4,5,5,4,,4,2,Educators continue to find new and better methods
0,White/European,,1,1,38,Master's degree,Cognitive Psychology,5,4,4,4,5,4,4,2,4,5,5,5,5,4,4,5,5,4,4,4,2,60,5,5,4,5,5,4,5,3,4,4,5,5,5,4,4,5,5,4,4,1,4,5,5,4,6,9,10,13,13,16,12,15,15,13,9,14,15,3,14,10,16,12,12,9,12,5,4,5,5,4,4,5,4,4,5,4,4,4,3,4,4,5,5,4,4,4,3,LGBT,5,-1,the gap will still be wider because the economic differences between social classes are even greater
0,White/European,,1,0,27,Master's degree,Edu stats,5,2,4,5,4,5,1,2,2,4,1,3,4,1,4,4,4,4,4,4,4,63,5,4,4,5,4,4,2,4,5,4,4,5,1,4,1,1,5,5,5,1,4,4,4,4,4,0,12,17,5,0,18,17,9,0,1,7,12,3,7,9,8,15,3,1,1,5,5,5,3,3,5,5,1,5,5,5,4,1,3,5,5,4,4,3,4,4,3,Y,1,1,We're better aware of issues than we were and the next generation is motivated to fix them
0,White/European,,1,1,27,Master's degree,Elementary education,4,5,5,5,5,5,2,2,2,5,1,2,4,5,2,4,4,3,5,3,5,70,2,5,5,5,4,3,5,5,5,3,4,5,5,2,1,1,2,5,2,1,5,5,1,5,0,0,0,10,5,0,5,5,0,0,0,10,15,3,10,0,20,20,5,0,0,5,5,5,1,1,5,5,4,5,5,5,5,1,3,5,2,5,5,5,5,5,5,The racial makeup of individuals who consult with and form IQ tests. ,1,2,It is my hope that American society will finally accept racial bias in testing and make strong changes to correct this issue. Race in isolation has nothing to do with potential intelligence though systemic racism makes it difficult for ethnic minority's in America to reach that potential. 
0,White/European,,1,1,38,Master's degree,MAE MAT,3,3,3,4,3,5,3,2,3,4,3,2,4,2,3,3,4,3,4,3,4,70,3,2,2,5,4,3,3,3,4,3,3,4,3,4,2,3,3,4,4,1,4,3,4,3,2,1,0,2,2,1,2,0,0,0,0,0,2,3,1,0,0,0,0,0,0,3,3,5,4,4,5,5,3,4,5,5,4,3,3,5,3,3,4,4,3,4,3,,3,1,Better nutrition healthcare poverty measures
0,White/European,,1,1,58,Master's degree,Mechanical Engineering,2,4,4,4,5,4,2,2,4,1,3,1,4,4,3,3,4,2,4,2,4,40,2,4,4,5,1,3,3,3,4,2,4,4,5,1,3,2,3,4,1,1,5,4,4,3,4,0,8,1,1,0,1,2,6,3,0,2,7,3,4,0,6,2,1,0,1,4,4,5,5,5,5,4,5,1,1,1,4,4,3,4,3,2,2,1,3,4,3,Gender,4,3,In time more blacks will see that bourgeois values leads to a better life.  The rate of single motherhood will decrease because it will be known to be a difficult life.  The middle-class values of graduate high school then get a job then get married then have a child will be seen as obviously beneficial and embraced.
0,White/European,,1,1,39,Master's degree,Teaching,4,4,2,4,4,4,3,2,2,2,2,2,4,4,2,2,4,2,4,2,4,40,4,3,3,5,2,3,2,2,4,2,2,4,4,2,2,1,4,4,2,1,4,4,3,2,1,1,1,1,1,1,1,1,1,1,1,1,1,3,1,1,1,1,1,1,1,3,3,4,4,4,3,4,4,4,4,4,4,2,3,4,4,4,4,4,4,4,3,,2,0,People are people.
0,White/European,,1,1,36,Four-year college degree,BA-Theatre Education,3,4,4,5,4,5,2,2,5,3,1,3,4,4,2,4,4,4,5,4,5,68,3,4,3,5,5,2,4,3,4,2,4,4,4,2,2,2,4,5,2,1,4,3,2,4,2,2,3,2,3,1,1,2,2,1,0,1,3,3,3,0,2,2,2,1,0,4,4,5,4,4,5,4,5,5,5,4,5,1,3,3,3,3,4,4,4,4,3,,4,1,While things are getting better I believe substantial change would take longer than 50 years
0,White/European,,1,1,34,Master's degree,Teaching,4,4,4,5,3,5,2,2,2,4,3,4,3,5,3,3,4,3,5,3,4,50,3,3,3,5,4,2,2,4,4,4,4,4,3,3,2,1,4,4,4,1,3,2,3,4,0,0,10,10,2,4,6,6,5,6,0,1,10,3,12,0,11,12,3,0,7,3,4,5,1,1,5,4,4,4,4,3,4,1,3,1,2,4,3,4,3,4,3,-,1,1,Studies like this will figure out the cause for the gap
0,White/European,,1,1,47,Master's degree,Instrumental Conducting,5,4,4,5,3,5,2,2,3,4,3,4,5,5,4,4,5,4,5,3,4,45,4,3,3,5,2,2,3,3,5,3,4,5,4,1,3,2,5,4,4,1,2,3,3,4,9,9,7,15,9,16,11,16,15,8,5,9,19,3,13,8,13,16,8,5,12,4,5,5,4,4,5,5,4,3,5,4,4,2,3,4,4,3,5,4,4,4,3,,4,1,I think we are more aware of how societal differences impact intelligence learning and academic achievement and are working to correct as many of those differences as possible.
0,White/European,,1,0,33,Master's degree,Theatre,5,3,4,5,4,5,2,2,2,4,1,4,4,4,4,4,5,5,5,4,4,35,2,4,4,5,2,3,3,4,4,3,3,4,4,1,3,2,2,2,4,1,5,4,4,2,4,6,3,6,1,1,4,6,4,1,1,1,10,3,6,3,2,3,6,5,8,4,4,5,3,3,4,5,5,5,5,5,5,1,3,2,4,4,4,4,2,3,3,,2,0,The structures that cause the score gaps will not change much.
0,White/European,,1,0,58,Master's degree,American History,4,4,2,5,4,4,3,2,4,4,3,4,3,5,2,4,3,4,4,3,4,68,3,2,2,5,2,2,3,3,2,2,4,4,4,2,3,2,2,4,2,1,4,4,4,4,8,10,0,8,5,8,3,5,5,7,0,7,11,3,7,0,9,9,0,0,6,5,1,5,3,3,5,3,3,3,3,5,3,3,3,4,4,4,4,3,4,4,3,,2,1,Racial inequality will continue to decline
0,White/European,,1,1,33,Four-year college degree,Theatre,5,2,4,5,5,5,1,2,4,2,1,4,4,4,4,3,4,5,5,3,5,60,2,3,3,5,4,1,3,4,5,3,3,4,5,1,2,1,4,4,2,1,4,4,4,2,0,0,10,10,0,0,10,10,10,5,0,0,15,3,5,0,8,5,5,5,2,4,4,5,4,3,5,5,4,5,5,4,4,2,3,2,1,1,3,4,5,4,3,,3,-1,Growing economic inequality
0,White/European,,1,1,25,Some college or technical school training,,1,1,5,5,5,4,5,2,5,1,4,1,5,1,5,1,5,1,5,1,5,35,1,5,5,5,1,5,3,5,1,5,5,5,5,1,5,1,2,5,1,1,5,5,1,1,3,0,0,0,5,0,0,0,0,0,0,0,0,3,0,0,0,0,0,0,0,5,5,5,2,5,2,1,1,1,1,1,1,5,3,5,1,2,2,1,1,4,3,,5,0,They've remained relatively the same in the past but I'm not entirely sure they will remain so.
0,White/European,,1,1,35,Master's degree,Secondary Education (Mathematics & Science),3,4,5,4,5,5,3,2,2,4,4,2,5,5,1,2,4,2,4,1,1,68,2,5,3,5,4,2,3,4,1,4,4,3,5,1,1,3,1,4,1,1,5,5,2,4,10,0,2,4,6,0,0,0,0,0,0,0,2,3,2,0,0,0,0,0,2,4,1,5,1,1,5,4,1,2,2,5,4,1,3,5,4,4,3,3,3,3,3,,2,1,Improvements in nutrition especially prenatal care will bring up lower scores and improvements in testing will reduce cultural bias.
0,White/European,,1,0,50,Master's degree,English ,2,3,2,4,2,5,1,2,2,4,1,2,2,2,1,4,4,3,4,3,4,51,4,3,3,5,2,2,2,2,2,3,3,2,3,2,1,1,1,2,1,1,3,2,2,2,1,1,4,4,5,5,5,6,8,2,4,5,12,3,10,3,9,6,2,1,3,2,3,5,3,3,5,2,2,2,3,4,4,1,3,4,2,3,4,3,4,4,5,Parental involvement ,4,0,Lots of separation of children from parental involvement or lack of involvement by either competent parents or inability of parents to property educational onfluence children.
0,White/European,,1,1,37,Master's degree,Business,4,3,4,4,5,5,4,2,4,3,2,5,5,5,4,4,5,5,5,3,5,70,2,3,4,5,3,2,4,4,3,3,4,2,5,1,2,2,2,4,4,1,5,4,4,4,2,1,2,4,2,1,5,6,1,1,1,1,10,3,3,2,8,6,4,5,3,4,4,5,2,2,5,5,5,3,4,4,5,3,3,4,4,4,5,4,5,5,3,Na ,2,1,Technology. We are continually getting better.
0,Hispanic/Latino,,1,0,49,Four-year college degree,English,2,2,4,5,3,4,2,2,2,3,2,4,5,5,2,4,4,3,4,3,2,48,3,3,3,5,4,2,3,2,2,3,3,4,4,2,3,2,2,5,1,1,4,4,3,5,0,0,1,0,4,0,2,2,2,0,0,0,4,3,4,0,2,0,0,0,0,4,4,5,4,4,5,4,4,4,4,4,4,3,3,4,4,4,4,3,4,4,3,,4,1,There are so many factors that play into the success or failure of students. 
0,White/European,,1,0,34,Master's degree,Education,1,4,5,3,5,4,5,2,5,3,3,5,5,5,4,3,5,2,5,2,5,62,3,5,5,5,1,5,3,4,1,5,5,3,5,1,3,2,4,5,1,1,3,5,2,4,0,0,0,0,0,0,0,0,0,0,0,0,0,3,0,0,0,0,0,0,0,3,3,5,5,5,5,4,4,1,4,1,4,3,3,4,5,1,4,3,4,4,3,none,5,1,To the extent that less advantageous upbringings like single-parent households reduce IQ scores the gap should close.  The white out-of-wedlock birth rate is rising steadily and as that gap closes so should the IQ gap. 
0,White/European,,1,1,42,Master's degree,Education / School Counseling,4,4,4,5,4,4,2,2,2,3,2,4,4,4,5,4,3,3,4,4,4,50,3,2,2,5,1,2,3,2,4,3,3,5,4,1,2,2,3,5,2,1,5,4,3,4,3,2,4,3,3,2,3,3,5,2,0,0,10,3,10,2,6,4,2,2,10,4,4,5,3,3,5,4,4,4,4,5,4,2,3,3,3,3,4,4,4,4,3,I dont' know.,2,1,Testing will get better.
0,African American,,1,1,30,Master's degree,Education ,4,2,4,5,4,5,3,2,2,3,3,3,5,5,4,4,4,4,5,4,4,80,4,3,4,5,5,2,2,4,3,3,4,4,4,2,3,2,4,4,4,1,2,1,4,5,1,1,2,4,1,0,5,11,12,6,6,6,13,3,9,1,9,13,10,9,4,3,3,5,4,4,5,4,4,4,4,4,4,4,3,4,4,4,3,3,4,4,3,,3,-1,N/A
0,White/European,,1,1,32,Four-year college degree,English,4,3,4,5,3,5,2,2,3,3,1,3,5,5,3,3,5,3,5,3,5,70,4,2,3,5,2,3,3,3,2,3,2,3,4,1,1,2,4,4,3,1,4,4,3,2,0,0,0,0,0,0,2,3,2,2,0,0,4,3,0,0,5,1,0,0,2,5,2,5,1,1,5,4,5,2,1,1,4,2,3,3,2,2,5,4,4,5,5,Individual family situations,4,1,Melding of language and culture through the years.
0,White/European,,1,1,47,Master's degree,Media literacy education,4,4,4,5,4,5,1,2,2,4,4,4,4,5,2,4,4,5,5,4,4,60,2,1,3,5,4,2,3,4,4,3,4,3,4,2,2,2,2,5,3,1,4,2,3,4,5,0,4,5,3,0,8,10,4,2,0,2,8,3,4,2,15,10,2,1,2,5,4,5,3,3,4,2,4,3,4,5,4,2,3,4,4,4,4,2,4,4,3,,2,2,Better measurement practices
0,White/European,,1,1,31,Master's degree,Educational Leadership,2,3,4,4,5,2,4,2,4,3,2,3,4,2,4,4,4,3,4,2,4,55,2,1,4,5,3,2,2,3,4,3,5,4,4,2,2,3,4,5,1,1,4,3,4,5,4,6,10,10,2,2,5,10,5,10,2,10,5,3,5,5,10,5,5,5,5,4,3,4,2,4,4,4,4,4,5,4,4,4,3,4,4,4,4,4,5,4,3,n/a,4,1,Technology will cause the narrowing of the ability levels between the rich and the poor.
0,White/European,,1,1,34,Master's degree,Religion,2,2,5,4,5,4,4,2,3,1,1,2,5,1,2,3,5,2,5,3,5,75,1,2,3,5,2,2,4,5,5,3,4,5,5,3,2,4,1,5,2,1,5,1,2,2,5,0,0,5,0,0,5,5,0,0,0,0,5,3,0,0,0,0,0,0,0,1,5,5,3,3,5,5,3,5,5,5,5,3,3,4,3,4,4,4,4,2,3,NA,2,0,Because this country hates poor people and minorities. Until we do something real about equity we will continue to overlook high IQ individuals who are not generally wealthy and white.
0,White/European,,1,1,32,Four-year college degree,Middle Childhood Education,3,2,4,5,3,4,3,2,3,3,2,4,5,4,1,3,5,3,5,3,5,60,3,2,2,5,2,1,4,3,3,2,3,4,4,2,2,1,5,5,2,1,4,3,2,3,0,10,5,15,3,10,5,10,10,5,3,3,15,3,8,1,8,10,2,2,2,4,3,5,2,2,5,4,4,4,4,4,2,2,3,4,2,3,2,4,4,3,3,,1,2,More research into less bias in testing. 
0,White/European,,1,1,31,Four-year college degree,Theater Arts Education,4,4,5,5,2,5,2,2,3,3,2,4,5,4,2,3,5,3,5,2,4,62,2,2,3,5,5,1,3,4,4,3,4,3,3,1,2,1,1,4,1,1,4,2,4,4,3,5,5,10,11,8,8,11,7,3,3,5,17,3,11,2,14,14,3,6,6,2,4,5,3,3,5,4,5,2,2,1,5,2,3,4,2,1,2,4,4,5,1,Shoe size,2,1,There is a large discussion happening about race in America. It seems likely that this as well as previous dialogues will draw light to disparities in performance and opportunity. Steps will likely be taken to try and remedy mistakes or close gaps where possible (e.g. Affirmative Action).
